DateTime,TweetId,Text,Username,Language,Hashtags,ReplyCount,RetweetCount,LikeCount,QuoteCount
2023-04-19 21:33:05+00:00,1648801920339918848,"The executive order I signed yesterday is the most comprehensive set of actions any administration has taken to increase access to high-quality child care, long-term care, and support for caregivers. https://t.co/owp4QAbqkP",JoeBiden,en,,1451,1362,7640,86
2023-03-16 20:06:17+00:00,1636458886948352000,"With new measures to expand health coverage, cap prescription drug costs, invest in quality child care, build affordable housing, reduce home energy bills, make college more affordable, and more, my budget would continue lowering costs for families.",JoeBiden,en,,999,697,3807,56
2022-06-15 19:11:01+00:00,1537150703633850371,"When I hear “climate,” I think jobs. 

Good-paying, high-quality jobs that will help speed our transition to a green economy of the future and unleash sustainable growth.",JoeBiden,en,,4716,2610,16255,655
2022-04-29 23:09:00+00:00,1520178366015549446,"A stronger economy built from the bottom up and the middle out puts greater power in workers' hands to improve their lives, provide for their families, and choose higher quality, higher-paying, and safer jobs.",JoeBiden,en,,2804,2291,13063,262
2022-04-06 00:56:00+00:00,1511507984463052815,"Over 31 million people now have health insurance through the Affordable Care Act.
4 out of 5 Americans can find quality coverage for under $10 a month.
The average family is saving $2,400 a year on their premiums.

The Affordable Care Act is stronger now than it has ever been.",JoeBiden,en,,1902,1754,12164,218
