DateTime,TweetId,Text,Username,Language,Hashtags,ReplyCount,RetweetCount,LikeCount,QuoteCount
2020-09-25 21:00:01+00:00,1309598556559347713,"We are in the middle of a climate emergency — and every day that Donald Trump remains in the White House further threatens the future of our planet.

We have to vote him out. https://t.co/NkSJ7bvBoE",JoeBiden,en,,2360,4211,16395,358
2020-09-18 18:35:00+00:00,1307025345082724352,"I can't believe I have to say this, but if I'm elected president, I won't put a climate change denier — one who called the scientific community ""a bunch of thugs"" — in charge of the National Oceanic and Atmospheric Administration. https://t.co/FcRtv8ZcYS",JoeBiden,en,,2330,8956,39144,476
2020-09-17 01:10:00+00:00,1306399974276526081,"If you give a climate arsonist four more years in the White House, why would anyone be surprised if more of America is ablaze? https://t.co/DwCIoNkwk1",JoeBiden,en,,2629,4725,19295,475
2020-09-16 14:20:00+00:00,1306236396378546179,"Donald Trump’s climate denial may not have directly caused the record fires we’re seeing on the West Coast. But if he gets four more years in the White House, they’ll only become more common, devastating, and deadly. https://t.co/7rsG9VDZ4w",JoeBiden,en,,2935,6026,22440,471
2020-09-15 00:35:00+00:00,1305666390670675969,"When Donald Trump thinks about climate change, he thinks “hoax.” 

I think “jobs.”

Good paying, union jobs that put Americans to work building a stronger, more climate-resilient nation. https://t.co/AKl9jZKB0s",JoeBiden,en,,3528,8408,33979,684
2020-09-14 23:25:00+00:00,1305648774157565952,".@realDonaldTrump, you know what’s actually threatening our suburbs?

Wildfires. Floods. Hurricanes.

We need to act on climate. Now.",JoeBiden,en,,18037,30289,181194,3596
2020-09-14 17:28:55+00:00,1305559162080747525,Climate change is the existential challenge that will define our future as a country. Tune in as I discuss the wildfires up and down the West Coast — and how I'll tackle the climate crisis head-on and create millions of good-paying jobs: https://t.co/yMhodX8RYe,JoeBiden,en,,2967,3586,11591,443
2020-09-12 18:21:00+00:00,1304847494518575108,"The science is clear, and deadly signs like the fires out West are unmistakable — climate change poses an existential threat to our way of life.

We must act now to avoid a future defined by tragedies like the one American families are enduring today. https://t.co/iGNTQVOy3t",JoeBiden,en,,3292,5478,21226,563
2020-09-10 20:00:01+00:00,1304147637201854464,"Make no mistake: Climate change is already here — and we’re witnessing its devastating effects every single day. 

We have to get President Trump out of the White House and treat this crisis like the existential threat that it is. https://t.co/NXzkpaRVsY",JoeBiden,en,,3411,6006,20955,642
2020-08-20 12:50:57+00:00,1296429516307431424,".@BarackObama led our nation back from the brink of economic collapse. He rallied the world to take on the scourge of terror and the threat of climate change.
When he tells you that our democracy is on the line this fall: listen. Vote.

https://t.co/MtT1Nu2GVs",JoeBiden,en,,2294,5755,29978,408
2020-08-20 01:28:00+00:00,1296257643653165056,"When I hear the words “climate change,” I hear another word: “jobs.” We can solve our climate crisis and our economic crisis at the same time. #DemConvention https://t.co/PZQvGM2uTR",JoeBiden,en,['DemConvention'],821,2839,13642,289
2020-08-09 15:00:02+00:00,1292475731172261894,Our planet can’t take four more years of Donald Trump. We have to get him out of the White House so we can start treating the climate crisis like the urgent threat it is.,JoeBiden,en,,21368,25718,172829,4174
2020-07-20 15:00:01+00:00,1285227969930072066,"Imagine the future we can create with Donald Trump out of the White House. A future where we:

- Tackle the climate crisis
- Build a new American economy
- End our gun violence epidemic
- Ensure our government works for all, not just the wealthy few",JoeBiden,en,,10458,18648,103138,2195
2020-07-15 21:00:00+00:00,1283506626348167178,"Meeting the threat of climate change presents a once-in-a-lifetime opportunity to jolt new life into our economy. We're going to create millions of high-quality, union jobs by building a modern infrastructure and a clean energy future. https://t.co/zzLLfkPcot",JoeBiden,en,,2139,4371,19303,388
2020-07-15 20:02:00+00:00,1283492028177940485,"There is no time to waste when it comes to addressing the existential threat of climate change. If I have the honor of being elected president, we'll get to work delivering results on day one. https://t.co/YLuhSkl7ux",JoeBiden,en,,1691,4013,16998,358
2020-07-15 00:40:00+00:00,1283199601001009159,"We're facing an economic crisis and a climate crisis.  

As president, I'll create millions of jobs building resilient roads and bridges, manufacturing electric vehicles, and weatherizing homes and buildings. 

Learn more: https://t.co/VS3yoJmSzQ https://t.co/IZIfHPTCjU",JoeBiden,en,,2182,3311,13825,364
