DateTime,TweetId,Text,Username,Language,Hashtags,ReplyCount,RetweetCount,LikeCount,QuoteCount
2020-10-30 23:32:00+00:00,1322320377943527424,"More than 9 million cases of COVID-19 have been now confirmed in the United States — and more than 228,000 Americans have lost their lives.

It is as severe an indictment of a president’s record as one can possibly imagine, and it is utterly disqualifying.",JoeBiden,en,,4735,6668,43623,915
2020-10-29 22:31:00+00:00,1321942639109918720,"You have my word: if I have the honor of serving as your president, I will do everything in my power to defeat COVID-19.

Here’s my plan to get it done: https://t.co/zUWDfi0yQ8",JoeBiden,en,,3034,4911,31921,778
2020-10-28 21:26:00+00:00,1321563893001408512,"You can't make this up: Yesterday, the White House science office put out a statement listing ""ending the COVID-19 pandemic"" as the top accomplishment of President Trump's first term. 
https://t.co/46VkWJE0GN",JoeBiden,en,,6060,10464,61622,3142
2020-10-25 16:28:00+00:00,1320401735534268416,The hard truth is it didn't have to be this bad. But Donald Trump's shortsighted actions weakened our ability to respond to a pandemic long before COVID-19 reached our shores.,JoeBiden,en,,4064,10690,66410,1110
2020-10-24 16:36:00+00:00,1320041360771051522,"On Thursday, President Trump said we're ""rounding the turn"" when it comes to COVID-19.

On Friday, we set a new record for daily cases. 

We're paying the price for his failures every single day.",JoeBiden,en,,3692,13359,72732,1298
2020-10-23 20:40:00+00:00,1319740377486688257,"A slight change of tone from the president for one night doesn’t cover up the lies he told. It doesn’t change the fact that over 220,000 Americans have died from COVID-19 on his watch.

We can’t take another four years of Donald Trump’s failed leadership.",JoeBiden,en,,8189,17125,119713,2484
2020-10-23 19:32:00+00:00,1319723264927649792,"After eight months of this pandemic, we finally found President Trump's plan to beat COVID-19. https://t.co/KO4g328Uvr",JoeBiden,en,,9824,48173,179992,21782
2020-10-18 18:30:00+00:00,1317895724105895939,"COVID-19 cases are on the rise across the nation.

But instead of leading by example, Donald Trump continues to put others in danger with his campaign events that ignore expert-recommended precautions.

Every day he proves just how unfit he is to lead America through this crisis.",JoeBiden,en,,4672,10341,50674,702
2020-10-15 20:36:44+00:00,1316840452235186178,"During our contact tracing, we discovered around noon today that a member of the company that charters my airplane has also tested positive for COVID. This crew member was on the plane with me, but was more than 50 feet away. 

My COVID test from last night came back negative.",JoeBiden,en,,3120,5749,73585,840
2020-10-15 13:45:00+00:00,1316736837524713472,"The fact that Senate Republicans haven’t bothered to pass a COVID relief package but are rushing through President Trump’s Supreme Court pick says all you need to know.

We’ve got to flip the Senate, folks.",JoeBiden,en,,15826,41451,236324,3193
2020-10-14 22:30:00+00:00,1316506571082522626,"If President Trump has his way in the U.S. Supreme Court, long-term complications from COVID-19, like lung scarring and heart damage, will become pre-existing conditions that could result in higher premiums or denied coverage.

It’s unconscionable.",JoeBiden,en,,11588,15091,72902,1480
2020-10-13 20:15:00+00:00,1316110207366250496,"215,000 Americans have died from COVID-19 on Donald Trump’s watch. 

It’s the greatest failure of presidential leadership in our nation’s history.",JoeBiden,en,,7247,21150,118935,1478
