DateTime,TweetId,Text,Username,Language,Hashtags,ReplyCount,RetweetCount,LikeCount,QuoteCount
2020-02-05 02:13:09+00:00,1224878598508765185,"Too many Americans are working 2-3 jobs to pay the bills &amp; put food on the table. An economy that only works for those at the top is an economy that is broken.

To truly address income inequality, we must commit to good-paying jobs, affordable childcare &amp; paid family leave. #SOTU",KamalaHarris,en,['SOTU'],515,1937,8269,97
2020-01-15 00:39:00+00:00,1217244759628099585,"I believe in an America where it only takes one job to keep a roof over your head and put food on the table.

An America where children don't fear going to school because of mass shootings.

An America where health care is a human right.

Let’s make this our America.",KamalaHarris,en,,695,3670,22393,194
2020-01-14 16:07:04+00:00,1217115926790844417,"Let’s be clear—any order from Trump to block witnesses or evidence is further proof of his efforts to obstruct Congress from doing its job.
 
Mick Mulvaney, John Bolton, and anyone with firsthand knowledge of the president’s misconduct must testify.",KamalaHarris,en,,1326,8399,38149,353
2019-11-26 17:46:03+00:00,1199383831217942535,"Airline catering workers shouldn’t have to choose between paying their bills or seeing a doctor. Today I joined @unitehere in calling on @AmericanAir, @United, and @Delta to raise the minimum wage of catering workers to $15/hr and benefits. One job should be enough to survive.",KamalaHarris,en,,108,302,1124,16
2019-11-22 22:18:00+00:00,1198002717190430724,"Some of our most profitable businesses are selling weed. Those criminalized for doing the exact same thing should be first in line for those jobs—under my plan, they will. https://t.co/ckIBzjxD6B",KamalaHarris,en,,310,677,2677,70
2019-11-19 17:15:07+00:00,1196839332151255046,"I stand in solidarity with Delores &amp; Downtown Detroit security officers on strike protesting the unfair treatment they face for coming together to have a voice at their job and fighting for the benefits they need to support their families. #OneDetroit
https://t.co/wNOP5sswzw",KamalaHarris,en,['OneDetroit'],79,347,1287,11
2019-11-09 14:09:00+00:00,1193168615786323969,"It was great to be in the house of labor last night with @Culinary226. One job should be enough to raise a family. 
https://t.co/Pi4wm6uR2J",KamalaHarris,en,,88,273,1068,7
2019-11-07 18:48:01+00:00,1192514054616764418,When a father holding two jobs has to figure out how to make it to the next paycheck—while he pays more taxes than the richest 400 families in America—economic justice is on the ballot.,KamalaHarris,en,,571,2006,10955,116
2019-11-07 03:31:00+00:00,1192283281305350144,"If you're a working parent with a child in school, you understand that making ends meet often means multiple jobs, long days, and stressful scheduling. My Family Friendly Schools Act ensures that children have access to after-school care while their parents work.",KamalaHarris,en,,513,891,4925,147
2019-11-03 18:20:19+00:00,1191057532992839682,Raking leaves is as effective at combatting the climate crisis as your phone’s spellcheck is at fixing your tweets. @GavinNewsom is doing his job. Maybe you should try it.,KamalaHarris,en,,3110,10220,54789,1057
2019-10-27 22:44:36+00:00,1188587328916340736,"For over 50 years, Congressional Black Caucus Co-Founder John Conyers Jr., reminded us to fight for jobs, justice, and peace and ensured we never forget Martin Luther King Jr.'s sacrifice. We carry on his fight today.

My prayers are with his family today.",KamalaHarris,en,,115,654,3478,12
2019-10-17 12:18:00+00:00,1184805761517604864,"Rural America isn’t looking for more empty promises from their next president. I have a plan to create jobs through real investments, reverse the deeply harmful effects of the Trump Trade War, and increase access to critical infrastructure like broadband.
https://t.co/COWcMDYFEQ",KamalaHarris,en,,157,366,1178,43
2019-10-12 21:47:00+00:00,1183137013051973632,My program Back on Track gave kids a chance for redemption and growth. They deserved a second chance to change their lives for the better through job training and support. https://t.co/muci1zs6St,KamalaHarris,en,,64,420,1093,57
2019-10-10 00:11:02+00:00,1182086098316664832,"If you or your family could have used paid family or medical leave longer than what your job gave, we want to hear from you. Share your story and we'll be sharing some over the next week or so.  
https://t.co/ne2UVntzl7",KamalaHarris,en,,76,163,503,11
2019-10-01 23:11:00+00:00,1179171885986324480,Trump hasn't ever understood the gravity of his job. Period. https://t.co/yAFN6S2vfd,KamalaHarris,en,,834,1632,9075,159
2019-09-19 16:40:01+00:00,1174724840181379072,".@GM using health care as a bargaining chip is downright cruel. Proud to stand with the more than 48,000 @UAW members who are striking for fair wages, affordable healthcare, and job security. #StandWithUs
https://t.co/RJtrxOAEPr",KamalaHarris,en,['StandWithUs'],107,303,969,17
2019-09-16 17:36:00+00:00,1173651765356617728,"I stand in solidarity with the more than 48,000 United Auto Workers members who are striking for affordable health care, fair wages, and job security. When we raise our voices together, we can win. 
https://t.co/VJOhoBqjs6",KamalaHarris,en,,216,757,3172,47
2019-09-13 01:39:21+00:00,1172323851784470528,"We have a president who is issuing trade policy by tweet due to his fragile ego. Under a Harris Administration, we would export American products, not American jobs. #DemDebate",KamalaHarris,en,['DemDebate'],309,677,3041,35
2019-09-13 01:05:31+00:00,1172315337594814465,I grew up acutely aware of the flaws in our criminal justice system and chose to reform it from the inside. I took on the position that allowed me — without asking permission — to create a first in the nation initiative to help people arrested for drugs get jobs. #DemDebate https://t.co/LE2G1ZlOHG,KamalaHarris,en,['DemDebate'],140,421,1510,40
2019-09-09 11:12:03+00:00,1171018426460049416,"It’s time to end mass incarceration. 

This includes legalizing marijuana, sentencing reforms, and abolishing private prisons. With the addition of job training and education, these actions will reduce crime and help build healthy communities.",KamalaHarris,en,,24,126,335,12
2019-09-05 23:13:00+00:00,1169750307779305475,"My $10 trillion comprehensive climate plan will build a clean economy by 2045 and create millions of jobs. The work starts on day one of my presidency to ensure a thriving planet for future generations. 
https://t.co/wPXM1vhD8A",KamalaHarris,en,,1292,777,3085,210
2019-09-04 21:30:07+00:00,1169362027644686336,"The climate threat is great, but so is our opportunity. Together, we can improve America’s health &amp; create millions of new clean jobs, while restoring our global leadership on this issue.

Tune in to @CNN at 6:20 p.m. ET tonight to learn more about my Climate Plan For the People.",KamalaHarris,en,,176,178,645,23
2019-09-04 13:30:10+00:00,1169241245157339139,"My climate plan will:
✅Seek justice for communities most impacted by climate change
✅Hold polluters accountable
✅Build a clean economy that creates jobs
✅Reassert American leadership in this global fight",KamalaHarris,en,,303,613,2639,54
2019-09-04 10:07:47+00:00,1169190312180404226,"The climate crisis is an existential threat that demands bold action. My climate plan will take on powerful interests and build a clean economy, create millions of jobs, and guarantee every person’s right to breathe clean air and drink clean water.
https://t.co/AH71W9cPJh",KamalaHarris,en,,254,501,1571,78
2019-08-29 22:25:00+00:00,1167201513292402688,"My plan for Medicare for All will ensure that when families move, or people with disabilities change jobs, their coverage can move with them so that they have uninterrupted access to the critical care and services they need.",KamalaHarris,en,,344,377,1960,43
2019-08-28 16:09:02+00:00,1166744508333199362,"On the anniversary of the March on Washington we remember a Dream not yet fulfilled and the voices that must be heard. We must continue this fight for jobs, equality, the right to vote, and freedom. We stand on the shoulders of a legacy that forever reminds us we shall overcome.",KamalaHarris,en,,239,459,2213,43
2019-08-16 01:43:00+00:00,1162177910205231115,"Teachers go above and beyond their job for their students — past and present — every day. We need to pay them their value. 
https://t.co/hxTIzvMA7C",KamalaHarris,en,,237,1030,5997,120
2019-08-13 14:31:28+00:00,1161284138600685571,I stand in solidarity with the @unitehere airline catering workers who are protesting at @AmericanAir HQ today for higher wages and affordable health care. One job should be enough to pay the bills.,KamalaHarris,en,,137,295,1752,20
2019-08-10 01:40:00+00:00,1160002828276043776,"While thousands of Americans are killed by gun violence, Republicans choose to do the @NRA’s bidding. The House has done its job and passed a bill requiring universal background checks — Mitch McConnell must bring the bill to the floor.",KamalaHarris,en,,846,1758,7202,134
2019-08-02 01:11:42+00:00,1157096601887924224,"Today I was honored to spend the day with Delores as part of @SEIU's #WalkADay. 

After workers at her job went on strike for higher wages, they won $15/hour. But still, her company is denying them the right to join a union. This is wrong. Workers deserve that basic right. https://t.co/wNOP5sswzw",KamalaHarris,en,['WalkADay'],466,660,2955,51
2019-08-01 16:12:07+00:00,1156960811778285568,"We’re facing a climate crisis. We need a Green New Deal that ensures no communities are left behind, that achieves carbon neutral energy by 2030, and creates good-paying jobs for the future. We can’t wait.",KamalaHarris,en,,1661,713,3685,247
2019-08-01 00:33:04+00:00,1156724492409946113,"Under my Medicare for All plan:
✅You can go to the doctor and know you’re covered
✅No one can be denied care for a pre-existing condition
✅Wall Street, corporations and the top 1% will bear the brunt of the cost
✅You can change jobs and your health coverage goes with you",KamalaHarris,en,,232,503,2245,50
2019-07-29 20:42:01+00:00,1155941569419079680,"Imagine changing jobs and not having to worry about your health care coverage. Imagine going to the pharmacy and not having to worry about an outrageous price increase on the prescription drug you need. 

This is possible with my Medicare for All plan.
https://t.co/Iak0dOdKDY",KamalaHarris,en,,343,291,1330,52
2019-07-29 01:28:00+00:00,1155651153704693760,"As teachers prepare to go back to school, many are asking friends and family to help fund classroom supplies — even digging into their own pockets to provide for their students. It shouldn’t be like this. Teachers must have the resources they need to do their jobs.",KamalaHarris,en,,1252,3623,18784,407
2019-07-19 19:30:13+00:00,1152299624784420865,My Rent Relief Act provides a tax credit to families who spend 30% or more of their income on rent and utilities. We’ve got to make sure that nobody has to work two or three jobs—or cut corners on other basic necessities—just to keep a roof over their head.,KamalaHarris,en,,584,778,3937,116
2019-07-12 23:06:44+00:00,1149817395558719489,"More than 5,300 teachers left South Carolina’s public schools ahead of this upcoming school year. 

This is a nationwide crisis -- my plan would close the teacher wage gap and make it possible for educators to stay in their jobs. https://t.co/KHaA33tZPh",KamalaHarris,en,,285,483,1383,37
2019-07-12 17:01:21+00:00,1149725446248030209,"It is troubling, disheartening, and unbelievable to hear how Acosta described the challenges of prosecuting Epstein. If Acosta didn't know how to do his job, he should not have been in the position. https://t.co/BTBK2CW2j2",KamalaHarris,en,,317,775,3359,78
2019-07-06 23:56:00+00:00,1147655467080069121,"I’ve met too many teachers who are working 2-3 jobs, who stay up late worrying about how they’re going to pay the bills, instead of tomorrow’s lesson plan. As president, I’ll make the largest federal investment in teacher pay in U.S. history to help close the teacher pay gap.",KamalaHarris,en,,1503,2652,19922,326
2019-07-06 01:07:00+00:00,1147310947310166018,"Everyone should have access to a good job, dignified wages, and a roof over their head. On these issues, I won’t just talk: I’ll act. My Rent Relief Act will guarantee more money in families’ pockets who are struggling with rent.",KamalaHarris,en,,2025,1103,7679,334
2019-06-28 03:28:17+00:00,1144447400993533954,No one should have to work more than one job to pay the bills. #DemDebate https://t.co/4w8z7qBUg6,KamalaHarris,en,['DemDebate'],1123,2567,13553,445
2019-06-19 01:11:00+00:00,1141151361414893573,"In our America, nobody should have to work more than one job to keep food on the table and a roof over their head.",KamalaHarris,en,,865,1150,7263,144
2019-06-17 17:42:01+00:00,1140675980169814021,"My first-grade teacher Mrs. Wilson attended my law school graduation. It’s teachers like her who are shaping the leaders of tomorrow. But too many of our nation’s teachers have to work two or three jobs just to get by. My teacher plan would give them on average a $13,500 raise.",KamalaHarris,en,,598,1546,11192,104
2019-06-16 01:34:00+00:00,1140069985013960705,"Too many Americans have to work two or three jobs to cover their student loans, pay their rent, and keep food on the table. My LIFT Act would raise incomes for working and middle-class families by up to $500/mo.",KamalaHarris,en,,920,881,5126,143
2019-06-10 17:42:01+00:00,1138139265102204928,This election is a fight to make the case for our America. Where you only need one job to pay the bills. Where corporations are held accountable for paying women equally and treating workers with dignity. Where everyone has access to clean air and water.,KamalaHarris,en,,162,278,1399,27
2019-06-08 22:09:00+00:00,1137481680107778048,"As San Francisco's DA, I created Back on Track, a program designed to prevent recidivism among nonviolent, low-level drug defendants. The program provided job training and support and strengthened the community. More initiatives like these can reform our criminal justice system.",KamalaHarris,en,,263,218,1000,37
2019-06-07 02:31:00+00:00,1136822838474739712,The American people deserve a raise. One of the first things I’ll do as president is pass the LIFT Act to ensure the economy starts working again for working people by giving families up to $500/mo. I’ve met too many folks who are working 2-3 jobs just to make ends meet. Enough.,KamalaHarris,en,,1404,631,3079,232
2019-05-24 22:09:00+00:00,1132045863369531394,"The Equality Act is critical to ending discrimination against sexual orientation and gender identity nationwide. No one should ever be fired from their job or dehumanized because of who they are. Republicans, bring this bill to the Senate floor now.",KamalaHarris,en,,198,514,2170,29
2019-05-23 23:11:02+00:00,1131699085839339520,"Waitresses, rideshare drivers, short order cook. Those are just a few jobs almost 1 in 5 teachers work outside the school system just to make ends meet. When I am president, teachers will be paid fairly.
https://t.co/SzOglF1L6S",KamalaHarris,en,,143,269,1190,22
2019-05-18 18:40:00+00:00,1129818938769121281,"Thankful for our brave servicemembers this #ArmedForcesDay and every day. They give so much to keep our nation safe and we must honor their sacrifice by ensuring they have support when they come back home, including job training, health care, and mental health services.",KamalaHarris,en,['ArmedForcesDay'],85,366,1606,16
2019-05-15 02:27:28+00:00,1128487029082402816,Outrageous news coming out of Alabama. This law would effectively ban abortions in the state and criminalize doctors for doing their jobs - providing health care to women. https://t.co/90utkxn7J2,KamalaHarris,en,,1231,2899,9908,343
2019-05-03 23:20:00+00:00,1124453584182050816,"Women, people of color, people with disabilities, and LGBTQ Americans are often underrepresented in STEM jobs. Fixing the problem starts with investing in our classrooms. That is why I’ve introduced a bill to build a pipeline of diverse talent for these good-paying jobs.",KamalaHarris,en,,430,876,4610,57
2019-04-19 01:32:00+00:00,1119050984607686659,"This is what a national crisis looks like: Approximately 7,300 public school teachers in South Carolina left their jobs during or at the end of the 2017-2018 school year. https://t.co/0agNFv73nY",KamalaHarris,en,,272,730,1991,42
2019-04-16 01:04:00+00:00,1117956776165560321,"The average teacher makes about $1,000 less than they did 30 years ago. Our teachers are underpaid, undervalued &amp; overworked.

As President, I’ll pass the largest federal investment in teacher pay in American history to ensure they don’t have to take on 2-3 jobs to pay the bills.",KamalaHarris,en,,1414,5997,30340,433
2019-04-15 23:27:00+00:00,1117932363898605570,"When I was San Francisco’s DA, I created the Back on Track program to give young people arrested for first-time drug crimes, job training and support instead of prison. We need more initiatives like these to reform our criminal justice system.",KamalaHarris,en,,355,1102,5237,56
2019-04-14 01:03:00+00:00,1117231747014565888,"Our campaign is born out of a love for country. Together we can create an economy where one job is enough, health care is affordable for all, and teachers receive the respect they deserve.",KamalaHarris,en,,577,1039,5599,78
2019-04-12 19:04:00+00:00,1116779015854010375,"No family should have to worry about losing everything in the middle of a medical emergency. No family should have to work two or three jobs just to put food on the table. 

This is not the American Dream. We can and will do better for working people.",KamalaHarris,en,,284,631,3131,39
2019-04-05 17:34:37+00:00,1114219805647749122,"Public school teachers are more likely​ than non-teachers to have to work a second job. That’s not right. 

So I’ve introduced the largest federal investment in teacher pay in American history — giving the average teacher a $13,500 raise.",KamalaHarris,en,,602,2599,12950,228
2019-04-04 23:18:00+00:00,1113943833237250049,"We need to create an economy that works for everyone, not just those at the top. It’s time for a national commitment to good-paying jobs, affordable childcare, and paid family leave.",KamalaHarris,en,,343,587,2820,41
2019-04-03 23:08:00+00:00,1113578929116389376,"I hear these stories from teachers who are working two or three jobs just to pay the bills. It breaks my heart. They deserve better. 

As president, I will end the teacher pay gap with the largest federal investment in teacher pay in American history.",KamalaHarris,en,,424,921,5067,88
2019-03-28 19:18:02+00:00,1111346729880879104,The gap between what teachers and people with similar educations earn creates disastrous consequences. Teachers are leaving their dream jobs because they can’t make ends meet. That’s not right. They deserve better. My plan will help us retain and empower teachers.,KamalaHarris,en,,161,362,1668,28
2019-03-27 22:06:02+00:00,1111026619421024256,The United States is facing a teacher pay crisis. Public school teachers earn 11% less than professionals with similar educations and teachers overall are more likely than non-teachers to work a second job. Read my plan to fix this crisis at https://t.co/zbEdYxjhpk. https://t.co/A1vDa5mkl8,KamalaHarris,en,,139,198,628,12
2019-03-27 02:30:00+00:00,1110730661575442432,"The average teacher salary has gone down over the last decade and too many are working multiple jobs to make ends meet. We’ve failed to give teachers the respect they deserve. That’s why I’ve released a plan to provide the average teacher a $13,500 raise: https://t.co/zbEdYxjhpk.",KamalaHarris,en,,467,796,3561,86
2019-03-26 17:27:01+00:00,1110594015265804288,Teachers are more likely than non-teachers to work a second job. We all deserve an America where you only need one job to pay the bills. We must close the teacher pay gap. https://t.co/lM60mRgJ1d,KamalaHarris,en,,172,290,1164,36
2019-03-23 19:23:51+00:00,1109536254146854919,"Moments ago, I pledged that at the end of my first term as president we'll close the teacher pay gap with the largest federal investment in teacher pay in American history. 

No teacher should have to work 2-3 jobs to survive. That’s wrong. I’m ready to do something about it. https://t.co/opgTKHiSLm",KamalaHarris,en,,1543,3132,14877,466
2019-03-22 02:40:00+00:00,1108921237013700608,"Education has the ability to empower our children and improve their path in life. We have a responsibility to ensure our teachers are respected, earn dignified wages, and have quality health care, benefits, and every resource they need to do their job.",KamalaHarris,en,,471,1694,7715,128
2019-03-19 20:09:01+00:00,1108098067687968768,"I stand in solidarity with workers raising their voices for fair wages, job security, and better health benefits. I applaud them for organizing to demand what they deserve.
https://t.co/rdME1MxABY",KamalaHarris,en,,116,414,1881,12
2019-03-19 02:37:00+00:00,1107833319473991680,"As I’ve traveled the country, I’ve met with folks working two or three jobs just to get by. Their wages aren’t keeping up with the cost of living, gas, rent, and utilities. That’s why I proposed two bills to give middle-class and working families a lift up.",KamalaHarris,en,,643,1209,6766,103
2019-03-14 01:19:00+00:00,1106001749872177153,"Learn more about these Asian-American women who are getting the job done and not letting anyone — or anything — hold them back. 
https://t.co/VHd4j8N4Ee",KamalaHarris,en,,132,516,1834,34
2019-03-13 22:30:07+00:00,1105959249325318147,"LGBTQ Americans face real discrimination on the job, in our schools, and when trying to find and pay for a home. That needs to end. The EQUALITY Act would ensure members of the LGBTQ community are protected from discrimination nationwide. We must pass it.",KamalaHarris,en,,218,911,4032,45
2019-03-07 03:02:00+00:00,1103490956005912576,"Despite our differences, I believe the vast majority of Americans have so much more in common than what separates us. People want to keep their families healthy. To get a job and keep a job. To pay off student loans. It’s time we had leadership that recognized that.",KamalaHarris,en,,783,1320,7199,110
2019-02-27 02:55:00+00:00,1100590093214064642,No person should have to work more than one full-time job to put food on the table or pay the bills. Period.,KamalaHarris,en,,1833,4817,33535,500
2019-02-22 01:50:01+00:00,1098761796960309253,"We need to create an economy that works for everyone, not just the few. It’s time for a national commitment to good-paying jobs, affordable childcare, and paid family leave.",KamalaHarris,en,,1154,1628,9190,193
2019-02-09 20:33:00+00:00,1094333363773526016,"We're fighting for an America where you only need one job to pay the bills, live with dignity, and support your family. American workers are the backbone of our country — let's fight for an economy that works for them. https://t.co/wvHAJj43vd",KamalaHarris,en,,419,1341,5067,75
2019-01-28 18:17:20+00:00,1089950569786163201,"I’m running to be president of the people, by the people, and for all people. I’m running to fight for an America where you only have to work one job to pay the bills and where health care and education are fundamental rights. https://t.co/8wjehsmX7i",KamalaHarris,en,,1176,4331,22505,424
2019-01-26 00:31:00+00:00,1088957440815710208,We can no longer afford to wait to protect the Mueller investigation. It is imperative that Congress act so we can let him complete his job without any interference.,KamalaHarris,en,,538,3436,17969,130
2019-01-25 16:58:02+00:00,1088843446394204160,Today is another stark reminder that Special Counsel Robert Mueller must be allowed to complete his job without any political interference. Legislation must be brought to the Senate floor immediately to protect his investigation.,KamalaHarris,en,,425,3253,16753,119
2019-01-25 00:11:00+00:00,1088590020301205504,Our economy isn’t working for working people. I’ve met too many folks who are working two or three jobs just to pay the bills and make ends meet. Congress must pass the Rent Relief Act and LIFT Act to give families a break.,KamalaHarris,en,,958,2458,11416,189
2019-01-24 15:33:15+00:00,1088459725132443648,"This wall is not about securing the American homeland and securing the nation. If you really wanted to secure the nation, you’d pay those people to do the job that they took an oath to do every day. https://t.co/KQLky2UNu2",KamalaHarris,en,,928,5540,21844,336
2019-01-23 22:22:01+00:00,1088200203839160320,"“Imagine being an attack helicopter pilot and in the back of your head you’re thinking, ‘I could lose my job in a week.’ It’s extremely distracting.”
https://t.co/VSAtoMw251",KamalaHarris,en,,523,2647,8570,192
2019-01-21 22:51:40+00:00,1087482892954013697,"This campaign is a fight for the soul of our country. It’s a fight of and for the people. Together, we will fight for a country with strong public schools. A country where one job is enough to pay the bills. A country with health care for every single American.",KamalaHarris,en,,832,4012,22361,259
2019-01-20 03:08:01+00:00,1086822626687967232,No teacher should be forced to take on a second job in order to pay the bills. We have to be better than this. Thank you to our Los Angeles teachers for staying strong — I stand with you. #LAUSDStrike,KamalaHarris,en,['LAUSDStrike'],421,1535,8723,84
