DateTime,TweetId,Text,Username,Language,Hashtags,ReplyCount,RetweetCount,LikeCount,QuoteCount
2022-01-31 20:36:00+00:00,1488249730975031300,"Getting rid of lead pipes in our communities is about public health. It’s about keeping our kids safe in schools. It’s about strengthening apprenticeship programs and creating jobs. 

We’re working to strengthen our infrastructure and replace lead pipes across the country.",KamalaHarris,en,,489,680,5422,54
2022-01-28 19:13:00+00:00,1487141679790444544,"Last year was the greatest year of job growth in American history. 

Our economic plan is creating good jobs for Americans, rebuilding our manufacturing, and helping make our companies more competitive.",KamalaHarris,en,,944,1124,7784,95
2022-01-27 21:30:01+00:00,1486813773725896704,"We have a lot of work ahead of us, but this past year, America saw the fastest economic growth since 1984, with a record number of jobs added to the economy and a record drop in the unemployment rate. 

America is on the move.",KamalaHarris,en,,779,1040,7380,82
2022-01-21 15:37:01+00:00,1484550607600037889,"From adding 6 million new jobs to the unemployment rate dropping to 3.9%, last year was a year of enormous progress.

We’re getting America’s economy back on track.",KamalaHarris,en,,1094,1348,9744,94
2022-01-21 01:42:36+00:00,1484340622995513351,"In our first year in office:

—More than 6 million jobs created 
—The unemployment rate is down to 3.9%
—Unemployment claims are at their lowest level since 1969

We’re making historic progress for workers, small businesses, and our economy—and it’s only just the beginning.",KamalaHarris,en,,858,1575,9077,112
2022-01-20 21:10:02+00:00,1484272025720041481,"This past year, America has seen record job creation, economic growth, and small business creation. 

We’re rebuilding our economy to lift up all Americans.",KamalaHarris,en,,845,818,6338,122
2022-01-20 19:18:01+00:00,1484243838847836165,"Since President Biden and I took office, we have gotten shots in arms, got people back to work, and passed laws that will rebuild our crumbling infrastructure while creating good-paying jobs.

We are delivering on our promises for America’s working families.",KamalaHarris,en,,744,737,5274,157
2022-01-07 22:15:02+00:00,1479577345161932806,"Today’s jobs report: 

—Added 6.4 million jobs since January of last year 
—Lowest unemployment rate since the beginning of the pandemic
—Regained 84% of jobs lost in the pandemic 

Today is a historic day of our economic recovery as Americans are getting back to work.",KamalaHarris,en,,696,1270,7467,106
2021-12-21 01:29:00+00:00,1473103174726823947,"The Bipartisan Infrastructure Law will soon fix our roads and bridges, replace lead pipes, and connect families in urban and rural areas with accessible high-speed internet—and we will do all of this while creating good-paying jobs.",KamalaHarris,en,,920,1557,11362,86
2021-12-16 20:47:01+00:00,1471582662045409283,"Our economy is growing faster than it has in decades. Unemployment is down to 4.2%, and nearly 6 million jobs have been added since January.

We must make sure that everyone shares in this growth by lowering costs for families and removing barriers to success in all communities.",KamalaHarris,en,,840,1354,7950,108
2021-12-12 22:09:00+00:00,1470153741630332928,Every American deserves access to clean drinking water. The Bipartisan Infrastructure Law will help make that a reality by creating jobs that will start to replace lead pipes across the country.,KamalaHarris,en,,878,1950,15006,102
2021-12-11 02:36:00+00:00,1469496157722365956,"No parent should have to sit outside a fast-food restaurant so their child can do their homework online. The Bipartisan Infrastructure Law will create good-paying jobs that will help connect every American to affordable, high-speed internet.",KamalaHarris,en,,1795,2708,25459,211
2021-12-04 19:42:00+00:00,1467217644227121152,"Nearly 6 million million new jobs since President @JoeBiden and I took office. 

While there’s more work to be done, we are making tremendous strides to build our country back better than before.",KamalaHarris,en,,1386,2145,16980,178
2021-12-04 15:32:00+00:00,1467154730958958601,"I visited Charlotte, North Carolina to talk about the investments we’re making in public transit and jobs.

The Bipartisan Infrastructure Law will help people get to where they need to go.",KamalaHarris,en,,517,1058,8910,37
2021-12-01 20:54:01+00:00,1466148605039984646,"President @JoeBiden is working to address high gas prices and lower the costs Americans face at the pump. 

In the long run, we will reduce our dependence on oil and create good-paying jobs by transitioning to a clean energy economy. That’s why we must pass Build Back Better.",KamalaHarris,en,,1302,1637,11631,184
2021-11-30 02:28:00+00:00,1465507877393776642,"Our administration has seen 5.6 million jobs created by the economy—more jobs in our first nine months than any other administration in American history. 
https://t.co/ZQ3SVFnlzO",KamalaHarris,en,,975,1539,7741,228
2021-11-27 17:39:00+00:00,1464649976164798464,"As President Biden says, America’s small businesses are the primary job creators, innovators, and drivers that power our nation’s economic progress. On Small Business Saturday and throughout the holidays, be sure to shop local and support the backbone of our communities.",KamalaHarris,en,,956,1945,14328,119
2021-11-27 00:20:00+00:00,1464388502964084740,"Under the Biden-Harris administration, America has seen record job creation, economic growth, and small business creation. 

We’re rebuilding our economy to lift up all Americans.",KamalaHarris,en,,2588,2893,22407,285
2021-11-21 22:29:00+00:00,1462548628254466048,"The Infrastructure Investment And Jobs Act proves that, in America, we have the courage to believe a better future is possible—and to build it together.",KamalaHarris,en,,747,1833,14029,87
2021-11-16 01:50:00+00:00,1460424886338428929,"Together, the Bipartisan Infrastructure Deal and Build Back Better Act will create good-paying jobs, rebuild our crumbling infrastructure, lower costs for working families, and make historic investments in our future.",KamalaHarris,en,,451,1131,8182,41
2021-11-15 23:04:00+00:00,1460383110764408835,"The Bipartisan Infrastructure Deal is a once-in-a-generation investment in America’s infrastructure. It will deliver: 

— Repaired roads and bridges 
— Clean water
— High speed internet
— Stronger supply chains
— A more resilient electrical grid
— Good-paying jobs",KamalaHarris,en,,551,1702,9480,117
2021-11-15 21:37:07+00:00,1460361244897128456,"President @JoeBiden just signed the Bipartisan Infrastructure Deal into law. 

It will create good-paying jobs, strengthen our supply chains, and invest in modernizing everything from our bridges and roads to our electrical grid.",KamalaHarris,en,,674,2097,15524,107
2021-11-15 01:35:00+00:00,1460058722223497218,"While our economy has added 5.6 million jobs this year, people across the country are seeing higher prices on everything from gas to groceries.

The Bipartisan Infrastructure Deal and Build Back Better Act will help lower costs for working families.",KamalaHarris,en,,1365,2492,15207,138
2021-11-14 22:26:12+00:00,1460011209953058829,"The Bipartisan Infrastructure Deal will create good-paying, union jobs in transforming America’s infrastructure. https://t.co/T0Ir1ss4nb",KamalaHarris,en,,382,616,3623,24
2021-11-12 17:07:05+00:00,1459206122900971529,"President @JoeBiden’s Build Back Better Framework will create millions of good-paying jobs, ensuring that American workers, businesses, and farmers can compete and win in the 21st century.",KamalaHarris,en,,786,1232,8470,75
2021-11-09 23:30:03+00:00,1458215335753039875,"By investing in the clean energy economy, we can create good-paying jobs, help families cut down on their home energy bills, and reduce greenhouse gas emissions. That’s what the Build Back Better Framework does.",KamalaHarris,en,,938,1301,9729,98
2021-11-08 01:35:00+00:00,1457522006790971396,"More than 193 million Americans are now fully vaccinated, children 5 and up are eligible to receive the vaccine, and the economy added more than half a million jobs in October. 

We are accelerating the path out of this pandemic.",KamalaHarris,en,,1156,2404,20095,140
2021-11-07 23:02:00+00:00,1457483503420026887,"The Bipartisan Infrastructure Deal will create millions of good jobs across the country. Jobs in red states, blue states, rural communities, small towns, and big cities. 

This is an investment in all of America. 
https://t.co/0J5g9bMB6N",KamalaHarris,en,,390,769,4610,44
2021-11-07 21:08:00+00:00,1457454815026556944,"The U.S. has added 5.6 million jobs since President @JoeBiden took office. 

This recovery was sparked by the American Rescue Plan putting money directly in the hands of working families and launching one of the fastest mass vaccination campaigns ever.",KamalaHarris,en,,926,1944,12148,92
2021-11-07 01:37:00+00:00,1457160122141224963,"Our Bipartisan Infrastructure Deal will lower costs for working families, modernize our ports, reduce supply chain bottlenecks, and ease inflationary pressures on the economy while creating millions of good jobs. 

America is getting back to work.",KamalaHarris,en,,556,1016,7900,54
2021-11-06 21:47:00+00:00,1457102241421271046,"This year, our economy has created 5.6 million jobs, unemployment is below 5%, we have a Bipartisan Infrastructure Deal to rebuild our nation’s infrastructure, and the Build Back Better Framework is on the way. 

President @JoeBiden is delivering for the American people.",KamalaHarris,en,,824,1628,10289,128
2021-11-06 18:51:00+00:00,1457057949940129801,"The Bipartisan Infrastructure Deal will create millions of good jobs, help build our clean energy economy, and deliver clean water and high-speed broadband to communities across the country. 

It’s a win for all Americans. https://t.co/miCMEmbGNj",KamalaHarris,en,,350,667,4556,42
2021-11-05 19:42:00+00:00,1456708397634568196,"Our economy created 531,000 jobs last month, exceeding expectations. We are making tremendous strides to build our country back better than before. https://t.co/VUp6Hxs5ex",KamalaHarris,en,,639,776,5166,66
2021-11-04 13:59:00+00:00,1456259690338258944,"The Build Back Better Framework will be a transformative investment in climate, care, and kids that will lower costs for families, create good-paying jobs, and grow the economy.",KamalaHarris,en,,898,1154,8832,85
2021-10-25 01:25:00+00:00,1452446060618686464,The Biden-Harris administration has created more jobs in our first eight months than any other administration in American history.,KamalaHarris,en,,3422,3278,29494,451
2021-10-22 21:09:03+00:00,1451656871190859780,"Virginia, @TerryMcAuliffe is running for governor to build a strong economy that creates good-paying jobs and invests in education and workers, and to protect the progress we’ve made.

Let’s elect Terry and Democrats up and down the ballot. https://t.co/FoYtjhIi5R",KamalaHarris,en,,522,1169,5812,47
2021-09-25 17:18:03+00:00,1441814266982641664,"Our Build Back Better Agenda will cut taxes for the middle class, lower costs for working families, create jobs, and sustain economic growth for years to come.",KamalaHarris,en,,1175,1629,13750,131
2021-09-18 17:30:00+00:00,1439280559788859399,"If big corporations and the very wealthy pay their fair share, we can invest in the American people, cut taxes for the middle class, reduce health care costs, create jobs, fight climate change, and so much more. https://t.co/4U1XeNqe2V",KamalaHarris,en,,1155,1374,8792,111
2021-09-18 14:42:00+00:00,1439238281766522883,Our Build Back Better Agenda will lower costs for middle-class families and create millions of good-paying jobs rebuilding our country's infrastructure.,KamalaHarris,en,,1603,1614,13154,171
2021-09-08 19:44:09+00:00,1435690440867602437,"Campaigning with Gov. @GavinNewsom today—a leader who has guided California through unprecedented crises and is a key partner to building our economy back better than before. Let’s keep him on the job.
https://t.co/YE6jJB6W5k",KamalaHarris,en,,895,856,4837,81
2021-08-14 16:45:03+00:00,1426585670429073411,"The Bipartisan Infrastructure Deal will generate millions of jobs, modernize our transportation infrastructure, and create a more sustainable future for our children.",KamalaHarris,en,,956,1491,13645,93
2021-08-14 01:23:00+00:00,1426353629133512704,"To date, we’ve created more jobs than any other administration has in its first six months. While there’s more work to be done, we are making tremendous strides to build our country back better than before. https://t.co/i6Yp7xlSY6",KamalaHarris,en,,1637,1353,9504,192
2021-07-23 23:48:47+00:00,1418719776445276166,"Virginia Democrats are fired up and ready to continue creating good-paying jobs and ensure every child has a world-class education. Tune in for a grassroots event with @JoeBiden and @TerryMcAuliffe. 

https://t.co/ba7pmRZIqr",KamalaHarris,en,,433,608,4210,26
2021-07-18 22:22:00+00:00,1416885996520714241,"We believe tackling climate change, improving communities, and creating jobs can occur simultaneously. We can do this and more with the Build Back Better Agenda.",KamalaHarris,en,,1493,2344,25302,157
2021-05-16 23:41:57+00:00,1394075681286496262,"The American Jobs Plan will put Americans to work fixing the roads you drive on every day, getting rid of the lead pipes that harm our children, and expanding broadband so every American has access to affordable high-speed internet.",KamalaHarris,en,,3063,2502,25992,184
2021-05-14 19:47:05+00:00,1393291800438259712,"More than one-third of people who live in rural America lack access to reliable high-speed broadband.

The American Jobs Plan will bring affordable, reliable, high-speed broadband to every American—all while creating good-paying jobs.",KamalaHarris,en,,1573,1468,14309,128
2021-05-11 23:00:16+00:00,1392253249311358989,"Good transit equals vibrant communities.  

The American Jobs Plan is not just an investment in millions of jobs rebuilding the infrastructure of our country. It’s an investment in improving communities. It’s an investment in increasing access to opportunity.",KamalaHarris,en,,1384,1012,9665,83
2021-05-11 17:05:54+00:00,1392164073417187330,The American Jobs Plan is about building up America’s workforce. https://t.co/s7pQ740FQB,KamalaHarris,en,,774,710,6347,52
2021-03-31 20:36:49+00:00,1377359248544309250,"Thanks to President @JoeBiden’s leadership, help is here. Watch as he speaks live from Pittsburgh about the investments we need to make in our country—and the good-paying, union jobs of the future that we can create.",KamalaHarris,en,,939,1119,9787,85
2021-01-15 02:03:55+00:00,1349900088299188225,"“We will finish the job of getting a total of $2,000 in cash relief to people who need it the most.

The $600 already appropriated is simply not enough.” 
—Your next president, @JoeBiden",KamalaHarris,en,,9919,12555,134863,4774
2021-01-09 22:12:08+00:00,1348029818219208706,"My mother taught me that no matter how you earn a living, whether you’re a caregiver or truck driver, grocery store clerk or small business owner, every job has inherent value and worth. https://t.co/qjUkMvtquA",KamalaHarris,en,,3480,6006,58581,847
2020-12-22 02:18:00+00:00,1341206322042290176,"The Georgia runoffs are about health care, about jobs, about justice. This will not be easy but it is within our power to change the course of our nation’s history by electing @ReverendWarnock and @Ossoff. https://t.co/TjYeiD5T6a",KamalaHarris,en,,691,3168,16717,198
2020-12-19 21:56:39+00:00,1340415777091047424,"The Biden-Harris administration has one of the most ambitious climate plans in history:

✓Secure carbon-pollution free electricity by 2035. 
✓Achieve net-zero emissions no later than 2050.
✓Invest in a clean energy future, and create millions of good-paying jobs.",KamalaHarris,en,,1598,2431,26228,343
2020-12-17 00:27:07+00:00,1339366480589320192,"With @PeteButtigieg’s leadership, we are ready to write the next great chapter in our nation’s history, modernizing our infrastructure, creating jobs and opportunity, and helping usher in a clean energy future. https://t.co/BFiEJMfKfJ",KamalaHarris,en,,798,1391,14752,128
2020-12-16 17:00:58+00:00,1339254201864491010,To build back better we need to usher in a sustainable transportation system that helps us connect all Americans to jobs and opportunity. @PeteButtigieg will do that as Transportation Secretary. https://t.co/SqHBwIrOhV,KamalaHarris,en,,433,937,9925,72
2020-12-04 20:19:10+00:00,1334955427646226432,We need to build a new American economy that works for everyone. Tune in now as @JoeBiden addresses the final jobs report of 2020 and how we will get through this economic crisis together. https://t.co/YyIeg6L5lP,KamalaHarris,en,,728,984,9640,103
2020-12-03 23:28:49+00:00,1334640766476546048,"No matter where you live, everyone wants to be able to get a job and keep a job.

No matter who you love, everyone wants to be able to buy a home and keep a home.

@JoeBiden and I understand that and together we’ll create an America where opportunity is within reach for everyone.",KamalaHarris,en,,1798,3143,40141,383
2020-11-17 15:22:39+00:00,1328720212921823236,"On the campaign trail, Joe and I met essential workers who’ve stayed on the job as they worry about their family’s safety. 

We met small business owners who’ve dipped into their own savings to make payroll. 

Their stories have stayed with us. We'll build back better for them.",KamalaHarris,en,,2264,4550,58096,400
2020-11-01 20:45:02+00:00,1323003134290071555,"Future generations deserve clear air, safe rivers, and a livable planet that we can pass down.

@JoeBiden and I will listen to the scientists, transform our energy sector, and create millions of jobs in the process.",KamalaHarris,en,,1695,6418,53719,568
2020-10-24 17:35:27+00:00,1320056324542136321,"If you already voted, your job’s not finished yet: with only 10 days until Election Day, we need your help talking to voters in critical battleground states and reminding them to cast their ballots. Sign up to make calls today: https://t.co/5GJfTjAUrl",KamalaHarris,en,,704,1440,8410,132
2020-10-09 01:46:59+00:00,1314381816627953664,"Young people graduating from college are wondering if they can get a job. People are worried about whether they’ll be able to make rent. This is where the American economy is right now, and it’s because of the failure of leadership of this administration.",KamalaHarris,en,,5813,10994,81303,830
2020-09-29 21:15:07+00:00,1311051909055369219,"Because of Justice Ginsburg, people could get the job of their dreams, earn equal pay for their work, marry the person they love, and enjoy the full rights and privileges of citizenship that they deserve—free of discrimination.
 
Her legacy is at stake.",KamalaHarris,en,,761,5615,31010,157
2020-09-22 21:33:01+00:00,1308519695914594304,"Parents are praying for their children’s safety at school.
Essential workers are risking everything to do their jobs.
Small businesses are struggling to keep the doors open. 
200,000 Americans have died.

It didn’t have to be this way. We just needed a competent president.",KamalaHarris,en,,2248,6121,27617,388
2020-09-18 20:04:51+00:00,1307047955711492096,"A Biden-Harris administration will create millions of good-paying, union jobs and ensure the future is made in America — by all of America. Tune in as @JoeBiden speaks in Hermantown, MN on how we’ll get it done. https://t.co/D3XkkfrJk1",KamalaHarris,en,,507,1059,4198,56
2020-09-08 00:46:00+00:00,1303132445773123589,".@JoeBiden is right. We must build a future that not only offers good-paying jobs, but protections and dignity for all workers.",KamalaHarris,en,,898,3483,19853,125
2020-08-27 22:07:07+00:00,1299106192803926019,"Tomorrow on the 57th anniversary of the historic March on Washington for Jobs and Freedom, I'm virtually joining @TheRevAl, @NationalAction, and @OfficialMLK3 for #MOW2020. Tune in starting at 11am ET and continue the ongoing fight for justice: https://t.co/mrhlnqm9vD https://t.co/jsPayQvY43",KamalaHarris,en,['MOW2020'],405,1618,6169,71
2020-08-25 23:54:01+00:00,1298408321033162752,"Let's be real clear: Donald Trump failed to take coronavirus seriously from the start. His lack of leadership cost millions of Americans their jobs and led to more than 110,000 small businesses closing for good. 

Americans deserve a real leader to fix this—and that’s @JoeBiden.",KamalaHarris,en,,5911,15644,80584,1067
2020-08-22 00:18:52+00:00,1296965022602723328,".@JoeBiden will bring us together to build an economy that doesn’t leave anyone behind—where a good-paying job is the floor, not the ceiling. https://t.co/qPKbunAeYg",KamalaHarris,en,,1148,3160,20687,164
2020-08-18 03:04:46+00:00,1295557220084658176,".@MichelleObama speaking truth to power. Donald Trump is not up for the job—but @JoeBiden is. 
https://t.co/UDCCofB0Rv",KamalaHarris,en,,5277,27805,140448,3051
2020-08-17 01:46:00+00:00,1295175011611938817,"As @JoeBiden always points out, this election is about more than politics. It’s about who we are as a country. It’s about the soul of our nation. Together we’ll create millions of jobs, fight the climate crisis, pass the John Lewis Voting Rights Act, and more.",KamalaHarris,en,,3972,13168,86785,699
2020-08-08 00:46:00+00:00,1291898421444517888,"Once this pandemic is over, we can’t go back to the way things were. We need to #BuildBackBetter. 

@JoeBiden has a plan to do that. 

He’ll revitalize American manufacturing and create millions of good-paying jobs, ensuring the future is made in America—by all of America.",KamalaHarris,en,['BuildBackBetter'],8929,7666,42492,1507
2020-07-23 21:32:02+00:00,1286413787487260674,"After Trump and his allies openly attacked Kim Gardner for doing her job, she received a slew of death threats and numerous racist and sexist emails. These shameful political and frankly dangerous attacks must end now.
https://t.co/oEnyydp0eM",KamalaHarris,en,,475,1262,3945,103
2020-07-15 16:12:07+00:00,1283434175517818880,"Today at 2:30pm ET I’m joining St. Paul Mayor @melvincarter3 for a virtual roundtable to discuss @JoeBiden’s #BuildBackBetter plan to repair our crumbling infrastructure and create millions of clean energy jobs. RSVP now. 
https://t.co/WR8IcldcOE",KamalaHarris,en,['BuildBackBetter'],119,330,1290,17
2020-07-10 21:19:01+00:00,1281699470498045953,"People are suffering. Small businesses have closed for good. People’s bills are piling up and they have no job to pay them. Parents are juggling teaching their kids and keeping food on the table.

We can help. Let's pass our small business bill and implement recurring payments.",KamalaHarris,en,,396,2347,9823,97
2020-06-30 19:05:02+00:00,1278041876856279041,"45 million Americans lost their jobs.
U.S. billionaires gained $584 billion. 

This pandemic is highlighting why income inequality is one of the most pressing issues of our time. 
https://t.co/h8rQoIxUXK",KamalaHarris,en,,278,2361,6538,89
2020-06-19 22:22:00+00:00,1274105178250268679,"Inequity runs deep in our country. It seeps throughout our education system, affects access to good-paying jobs with a living wage, affordable housing, and so many more issues. 

We must fully reckon with our country’s historic and systemic racism to enact change.",KamalaHarris,en,,368,1116,5231,61
2020-06-05 01:16:01+00:00,1268713151140331521,"He was reviewed for using force 79 times in three and a half years on the job. This is why we protest. 
https://t.co/Ra3QSbPx45",KamalaHarris,en,,929,9643,31128,515
2020-04-21 22:31:39+00:00,1252726721956261889,"I’ll be taking part in @JoeBiden’s #SOULSaturday and I hope you’ll join me in thanking our nation’s heroic essential workers and working to ensure they have the resources needed to safely do their jobs.
https://t.co/whWMKZ2Hg5",KamalaHarris,en,['SOULSaturday'],132,1104,3352,64
2020-04-06 02:37:51+00:00,1246990473316745219,"Thankful for our nation’s brave nurses who are day in and day out risking their own lives to help save coronavirus patients. We see you and we’re fighting to ensure you have the personal protective equipment needed to safely do your jobs. 
https://t.co/34HbmbIG8z",KamalaHarris,en,,129,1329,6710,51
2020-04-03 18:15:39+00:00,1246139315643715585,We are in a national crisis and the president doesn’t understand his job. https://t.co/7mlLtd9Khr,KamalaHarris,en,,1122,5878,23508,477
2020-03-26 16:11:01+00:00,1243208846706913281,"Nearly 3.3 million people are out of work. Hospitals are overflowing. And things will only get worse before they get better. 

Our job isn't over.",KamalaHarris,en,,335,2073,11498,77
2020-03-11 22:43:01+00:00,1237871677712650245,"Today marks the 5 years since I launched Back on Track LA as CA’s Attorney General, a program designed to give young people in our criminal justice system a second chance with job training and support. 

We need more initiatives like this to reform our criminal justice system.",KamalaHarris,en,,130,816,3909,46
2020-02-21 23:05:02+00:00,1230991850565259264,"In order to live up to our ideals as a nation, we must fight for economic justice. This means raising the minimum wage, making equal pay a reality, and creating a nation where one job is enough to pay the bills and keep a roof over your head.",KamalaHarris,en,,338,1076,5794,66
2020-02-05 18:08:03+00:00,1225118905250779136,"It couldn’t be more simple: the president was afraid he was going to lose the next election, so he decided to cheat. 

This is a clear abuse of power, a misuse of the office of the presidency.

Trump thinks he’s above the law—and it’s the Senate’s job to tell him he's not.",KamalaHarris,en,,3059,7264,46916,526
