DateTime,TweetId,Text,Username,Language,Hashtags,ReplyCount,RetweetCount,LikeCount,QuoteCount
2023-05-31 14:49:07+00:00,1663920549439963141,"From coast to coast, we are building a better future.

This year, 20,000 infrastructure projects will be underway that will transform communities, create good-paying jobs, and rebuild our nation's infrastructure. https://t.co/tfgXTMfUpM",KamalaHarris,en,,767,466,2545,33
2023-05-27 18:48:00+00:00,1662531113892364290,"Since President @JoeBiden and I took office, over 12.5 million new jobs have been created, including 800,000 manufacturing jobs.",KamalaHarris,en,,2999,807,4478,152
2023-05-23 20:02:06+00:00,1661100209697443840,"When President Biden and I took office, we vowed to rebuild America’s manufacturing sector, bring jobs back from overseas, strengthen our supply chains, and build in America.

And we have kept that promise by investing hundreds of billions of dollars in American manufacturing. https://t.co/CThOLGh51F",KamalaHarris,en,,3221,1052,5770,158
2023-05-23 15:47:30+00:00,1661036139086528519,"12.7 million jobs have been created since we took office
253,000 jobs were added last month
The unemployment rate fell to 3.4%

While we have more work to do, we are building our economy from the bottom up and the middle out. https://t.co/CCEQe14z9h",KamalaHarris,en,,1427,678,3493,69
2023-05-21 22:41:05+00:00,1660415444518313984,"Created over 12 million jobs.
Capped insulin at $35/month for seniors.
Passed the largest climate investment ever.
Made historic infrastructure investments.
Protected marriage equality in federal law.

We've made progress, but there’s still much more to do.

Let’s finish the job. https://t.co/8rbwS58A8y",KamalaHarris,en,,5781,1996,10786,262
2023-05-18 18:49:06+00:00,1659269898390974465,"For two years, President @JoeBiden and I have fought to uphold and protect the fundamental freedoms of the American people. 

We have stood together defending freedom and democracy, civil rights, human rights, and women's rights. 

And now, we need to finish the job. https://t.co/ke17WfxMLv",KamalaHarris,en,,1681,550,3075,97
2023-05-17 19:55:01+00:00,1658924100860125194,"When we invest in small businesses, we invest in jobs, opportunity, innovation, and in America.",KamalaHarris,en,,453,280,1682,27
2023-05-16 14:15:09+00:00,1658476182088876034,"217 House Republicans voted for a bill that could cut up to 60,000 teaching jobs—affecting more than 25 million kids. 

Our teachers and children deserve better. https://t.co/ktQ3RGIOKQ",KamalaHarris,en,,3874,1722,4999,159
2023-05-13 23:26:05+00:00,1657527665526439937,"Record job growth.
Largest investment in climate action in history.
Manufacturing is growing faster than it has in decades.
Greatest two years of small business creation on record.

President @JoeBiden and I are delivering for working families, and we're just getting started. https://t.co/OqIZjrIkSK",KamalaHarris,en,,3104,1337,6710,112
2023-05-12 18:28:00+00:00,1657090262949060622,"We have created more than 12.7 million new jobs. 

That’s more jobs created in the two years that we’ve been in office than any presidency has created in four.",KamalaHarris,en,,3363,745,3795,141
2023-05-12 15:23:00+00:00,1657043706753560583,"This Teacher Appreciation Week and every week, I’m thankful for America’s teachers. But they deserve more than thanks.

Teachers go above and beyond their job for their students every day—they deserve higher wages and better working conditions.",KamalaHarris,en,,555,596,3213,37
2023-05-11 22:00:11+00:00,1656781272562163712,"With unemployment now down to 3.4% and 253,000 jobs created in April, it's clear our economic agenda has powered a historic economic recovery.",KamalaHarris,en,,1362,599,3128,56
2023-05-09 15:00:20+00:00,1655950839843008512,"In 2020, voters sent @JoeBiden and me to the White House. 

In 2022, we were able to help defend reproductive rights on state ballots from California to Kentucky and win races up and down the ballot. 

In 2024, let’s finish the job.",KamalaHarris,en,,2278,853,4138,98
2023-05-01 16:00:54+00:00,1653066977550712833,I'm proud to run for reelection with President @JoeBiden so we can finish the job. https://t.co/x7uN8gbEKG,KamalaHarris,en,,16286,2974,26372,1163
2023-04-29 21:40:00+00:00,1652427539757821952,"Created more jobs in two years than any presidency has created in four. 
Unemployment is near its lowest rate in over 50 years. 

Our economic plan is working.",KamalaHarris,en,,16567,1937,11603,832
2023-04-27 20:00:16+00:00,1651677663625375749,Tonight at 6:45pm ET our team is hosting a virtual strategy call to mobilize supporters nationwide. Join us and help finish the job for the American people: https://t.co/GfaU15NS7A. https://t.co/b9s07aemcT,KamalaHarris,en,,1143,844,4577,72
2023-04-27 01:10:00+00:00,1651393223611367425,"We’ve helped create over 12 million jobs, lowered prescription drug costs, and taken the largest action to fight climate change in American history.

Now it’s time to build on our progress and finish the job. That’s why @JoeBiden and I are running for reelection.",KamalaHarris,en,,1514,593,3210,52
2023-04-26 16:00:26+00:00,1651254919486218241,"President @JoeBiden and I have a bold agenda, but we need to finish the job. 

We want to make our economy work for families like yours: those who are the backbone of this country. 

That’s why we’re running for reelection. https://t.co/KwQ0yGAoFx",KamalaHarris,en,,8741,1861,11844,416
2023-04-25 13:35:00+00:00,1650855934900543488,"More than 12 million new jobs. Historic action to tackle the climate crisis. Lower health care and prescription drug costs. 

We have made so much progress in our first two years, but there’s still so much more to do. 

Let’s finish the job.
https://t.co/fhnt1zhzJm",KamalaHarris,en,,1506,931,4883,73
2023-04-20 15:45:04+00:00,1649076724108255232,"Since President Biden and I were sworn in: 

—Over 12 million new jobs, including good-paying union jobs 
—Unemployment is near its lowest rate 
—American manufacturing is growing faster than it has in decades",KamalaHarris,en,,1773,526,2925,71
2023-04-18 19:37:05+00:00,1648410340550647808,"Since taking office, President Biden and I have helped create more than 12 million good-paying jobs—and American manufacturing is growing faster than it has in decades. https://t.co/cSVwYKT6rC",KamalaHarris,en,,1817,661,3565,64
2023-04-16 19:40:00+00:00,1647686297866125315,"When we invest in climate, clean energy, and U.S.-based manufacturing, we invest in American jobs.",KamalaHarris,en,,926,386,2397,20
2023-04-16 17:11:06+00:00,1647648823886397441,"Created over 12 million new jobs
Launched more than 20,000 infrastructure projects nationwide 
Strengthened American manufacturing 

We are getting the work done for the American people. https://t.co/R9E7znJ0LW",KamalaHarris,en,,1861,926,4940,104
2023-04-06 00:50:00+00:00,1643778045294129152,"The Inflation Reduction Act is the largest investment in history to combat the climate crisis.

That means cleaner air and water and millions of new good-paying jobs as we build a clean energy economy that works for all Americans.",KamalaHarris,en,,687,405,2243,24
2023-03-30 21:36:00+00:00,1641554896699772928,"With your support, we helped create 12.4 million jobs, made historic infrastructure investments, and protected marriage equality in federal law.

To build on our progress, we need to elect more Democrats nationwide in 2023. Can you chip in to the DNC now? https://t.co/5ldcLKosLH",KamalaHarris,en,,622,312,1982,21
2023-03-22 21:52:01+00:00,1638659823565959169,"The budget proposal President Biden put forward funds research, clean energy, and career training as we work to create good-paying jobs that don't require a four-year degree.

It’s an investment in American workers.",KamalaHarris,en,,178,282,1781,12
2023-03-22 14:00:17+00:00,1638541109059022849,"Our economy added 311,000 jobs last month. 

Since President @JoeBiden and I took office, we’ve created 12.4 million new jobs—the strongest two years of job growth on record.",KamalaHarris,en,,615,454,2643,45
2023-03-11 18:10:01+00:00,1634617688495382534,"The American Rescue Plan resulted in Americans getting back to work, more small businesses started in the last two years than in any two-year period in history, and cutting the child poverty rate in half. 

Now, we must build on that momentum and finish the job.",KamalaHarris,en,,317,330,1955,19
2023-03-11 15:45:06+00:00,1634581219735117826,"Two years ago today, President Biden signed the American Rescue Plan into law. 

It has helped working families and helped get our economy on the right track—having created more jobs in two years than any presidency has created in four. https://t.co/rutRGFbcoy",KamalaHarris,en,,823,523,3168,52
2023-03-02 18:33:26+00:00,1631362091490869248,We’re bringing down costs for the American people but the job is not done. https://t.co/BaopbaRWsy,KamalaHarris,en,,3769,618,3600,149
2023-02-28 16:48:03+00:00,1630610793476546560,"Last year, we passed historic investments in infrastructure, clean energy, and manufacturing. 

By the end of the year, more than 20,000 projects will be underway to transform communities, create good-paying jobs, and build a better future.",KamalaHarris,en,,137,247,1440,5
2023-02-25 18:20:05+00:00,1629546793615720450,"We have the momentum. 

Created 12 million new jobs. 
Capped insulin at $35 a month for seniors. 
Passed the largest climate investment ever.
Made historic infrastructure investments.
Protected marriage equality in federal law. 

Let’s finish the job. https://t.co/RYk8nh6fz4",KamalaHarris,en,,4247,2156,19516,295
2023-02-23 18:20:06+00:00,1628822020044603392,We’re investing more than $5 billion to replace dirty diesel transit buses with electric buses to eliminate a significant source of air pollution in communities and create clean energy jobs. https://t.co/vJjzPnMxaH,KamalaHarris,en,,474,558,3870,31
2023-02-21 22:06:05+00:00,1628154116483457025,Let’s finish the job. https://t.co/PXa1PBQlBf,KamalaHarris,en,,1772,1363,12354,150
2023-02-19 18:06:00+00:00,1627368921014718465,"President @JoeBiden and I took office during the worst economic crisis in a generation. 

While there’s still more work to do, two years later, our economic plan is working with 12M new jobs created, 10.5M total new businesses created, and the lowest unemployment in 54 years.",KamalaHarris,en,,1139,811,6021,75
2023-02-18 15:31:05+00:00,1626967548158791681,"We’re dedicated to building a clean energy future and delivering environmental justice for everyone, everywhere. 

That means helping create millions of jobs and working to achieve clean air and water for all. https://t.co/tBzfuzS7t7",KamalaHarris,en,,670,616,4456,67
2023-02-14 19:42:06+00:00,1625581164281925634,"From 12 million jobs created to lowering costs for families, President @JoeBiden and I are delivering results for the American people. https://t.co/faKUdFFrT1",KamalaHarris,en,,866,617,4205,47
2023-02-12 17:47:01+00:00,1624827426982223874,"12 million jobs have been created since we took office, 517,000 jobs were added last month, and the unemployment rate is at its lowest in 54 years. President @JoeBiden’s economic plan to rebuild an economy from the bottom up and middle out is working.",KamalaHarris,en,,840,527,3591,57
2023-02-09 23:08:01+00:00,1623821045684658179,"When it comes to the climate crisis, we don’t have time to waste. 

That’s why we passed the most significant investment ever to tackle climate change, which will lower utility bills, help create jobs, and lead us into a clean energy future.",KamalaHarris,en,,340,326,2243,23
2023-02-09 21:30:11+00:00,1623796425996791811,"As President @JoeBiden said, the state of our union is strong. 

Over the last two years, we've made significant progress toward building a future in which everyone can thrive. 

Now, it's time to finish the job. https://t.co/TXVj8w021d",KamalaHarris,en,,313,358,2604,15
2023-02-09 15:30:05+00:00,1623705806301528067,"In the last 24 months, the economy has created 12 million jobs in America, and more people are working than at any point in American history. 

While there’s still more work to do, we’re making immense progress.",KamalaHarris,en,,365,404,2664,28
2023-02-07 16:55:03+00:00,1623002412754558983,"The latest jobs report: 

—More than half a million jobs created last month
—12 million jobs have been added since we took office 
—Lowest unemployment rate in 54 years

Our economic plan is working.",KamalaHarris,en,,553,425,2375,37
2023-02-07 01:06:05+00:00,1622763596949356545,"I had the type of job where I could take time to be with my mother when she was diagnosed with cancer. 

Every worker should be able to take time off to care for the people they love. Together, we will work towards ensuring paid family and medical leave for every worker. https://t.co/00VxzVSRwK",KamalaHarris,en,,272,605,4935,20
2023-02-06 21:52:05+00:00,1622714776429162496,"America is seeing record job growth. 

When we lead, we build a future in which every American not only survives, but can thrive. https://t.co/vmnJ8VP6IO",KamalaHarris,en,,310,349,2083,23
2023-02-06 19:35:01+00:00,1622680278966669318,"Since President @JoeBiden and I took office, the economy has added a record 12 million jobs—that's more jobs in two years than under any president in a full four-year term.",KamalaHarris,en,,1694,1101,8102,123
2023-01-18 01:02:00+00:00,1615514812653469696,The Inflation Reduction Act’s climate investments will lead the nation into a new clean energy economy by helping generate millions of jobs—including jobs that don’t require a four-year degree—and advancing environmental justice in communities across the country.,KamalaHarris,en,,288,340,2179,21
2022-12-20 19:41:01+00:00,1605287171971338262,"Thanks to the Bipartisan Infrastructure Law's once-in-a-generation investments, we are implementing our plan to remove lead pipes, make high-speed internet accessible and affordable, and create more good-paying jobs.",KamalaHarris,en,,797,611,4221,38
2022-12-17 18:20:00+00:00,1604179622144327682,"10.5 million jobs have been created since we took office, 263,000 jobs were added last month, and the unemployment rate remains near historic lows. While we have more work to do, we are hard at work rebuilding our economy from the bottom up and the middle out.",KamalaHarris,en,,3816,1588,10021,206
2022-11-26 18:09:05+00:00,1596566729630646272,"When small business owners have the support they need, they create jobs, drive, innovation, and grow our economy. On Small Business Saturday and throughout the holidays, be sure to shop local and support the backbone of our communities. https://t.co/OLLGRmo4U2",KamalaHarris,en,,663,579,3374,43
2022-11-19 22:16:00+00:00,1594092153579372556,"—10 million jobs created 
—The unemployment rate is at a near match of a 50-year low

We’re making historic progress for workers, small businesses, and our economy.",KamalaHarris,en,,5017,1280,7953,200
2022-11-19 00:47:00+00:00,1593767764036096002,"The CHIPS and Science Act will lower the costs of everything from cars to dishwashers, create good-paying manufacturing jobs, and help ensure the United States manufactures more critical technologies here at home.

President @JoeBiden is leading a manufacturing boom.",KamalaHarris,en,,708,842,4156,49
2022-11-02 00:32:01+00:00,1587603401289916416,"We know what Democrats stand for: working people, good jobs at fair wages, decency, and democracy. 

All of these issues are on the ballot. Make a plan to vote at https://t.co/VbrfuqVy9P. https://t.co/42p4tgvXL7",KamalaHarris,en,,1281,578,2599,39
2022-10-23 16:18:00+00:00,1584217586254123008,"Democrats stand for the middle class. 

We stand for working families and for equality and equity for every American. 

We fight for good jobs. 

We fight for affordable health care and opportunity for all. 

When Democrats are in charge, we deliver.",KamalaHarris,en,,7619,1357,7487,465
2022-10-17 14:41:01+00:00,1582018851189198848,"Every single Republican in Congress voted against the Inflation Reduction Act. It will: 
 
—Lower prescription drug prices.
—Lower health care costs.
—Lower energy costs.
—Tackle the climate crisis.
—Create good-paying jobs.
—Create a fairer tax system.",KamalaHarris,en,,4127,1437,5764,246
2022-10-14 00:03:00+00:00,1580710729279508480,"The CHIPS and Science Act will create good-paying union jobs and grow the workforce in a way that benefits all of society.

President Biden and I are determined to lead the most pro-union administration in America’s history.",KamalaHarris,en,,566,435,2605,36
2022-09-25 22:03:00+00:00,1574157548042829826,"Senators are attempting to pass a national abortion ban and criminalize doctors for simply doing the job they were trained to do: Deliver health care. 

There’s a clear disconnect with the priorities of everyday Americans.",KamalaHarris,en,,1127,1534,9505,87
2022-08-31 22:22:00+00:00,1565102633156845568,"We have recovered all jobs lost in the pandemic. Schools are back open. Small businesses are growing. Because we are growing our economy the nation’s unemployment rate matches the lowest it’s been in 50 years. 

That’s progress.",KamalaHarris,en,,1122,987,7894,97
2022-08-22 19:31:00+00:00,1561798110334140417,"We're seeing the impact of climate change around our nation.

If we don't act now, it will be irreversible. 

The Inflation Reduction Act takes aggressive action on climate change while creating good-paying jobs in communities across our country.",KamalaHarris,en,,583,569,3448,33
2022-08-20 20:10:04+00:00,1561083163941765120,"The latest jobs report:

—Over half a million jobs were added last month
—Over 9 million jobs have been added since taking office
—Matched the lowest unemployment rate in half a century

There’s still more work to do, but we are making significant progress.",KamalaHarris,en,,486,768,4538,47
2022-08-19 19:16:01+00:00,1560707173251948545,"Thanks to President @JoeBiden’s leadership, the Inflation Reduction Act will lower health care costs, lower energy costs, fight the climate crisis, and create good-paying jobs.",KamalaHarris,en,,804,766,5623,56
2022-08-17 19:01:01+00:00,1559978623553134592,"Our economy created over half a million jobs last month and over 9 million jobs in the previous 18 months—meaning that we have recovered all the jobs lost during the pandemic. 

While there's more work to do, we're delivering for the American people.",KamalaHarris,en,,705,812,5598,54
2022-08-16 20:03:50+00:00,1559632042496860161,"President @JoeBiden just signed the Inflation Reduction Act into law. 

It will lower the cost of prescription drugs, reduce the deficit, address the climate crisis, and create jobs—and it’s paid for by making large corporations pay their fair share in taxes. https://t.co/KyFhR9e6yj",KamalaHarris,en,,362,756,4107,66
2022-08-05 16:22:01+00:00,1555589957032595457,"The Inflation Reduction Act would lower health insurance costs by an average of $800 yearly for 13 million Americans.

It would also reduce the cost of prescription drugs, reduce the deficit, address the climate crisis, and create jobs.

Let's send it to President Biden's desk.",KamalaHarris,en,,286,630,3167,28
2022-07-25 19:32:01+00:00,1551651503009660930,"Thanks to the American Rescue Plan, we are creating good-paying jobs for nurses, doctors, steel workers, pipe fitters, and engineers.

Together, we are investing in training programs and apprenticeships that give workers the skills to take on jobs with better wages and benefits.",KamalaHarris,en,,423,609,3840,45
2022-07-07 21:52:00+00:00,1545163751325929472,"Every worker deserves: 

—A safe and healthy workplace 
—A job with good wages and fair benefits 
—The choice to join a union 

We will do everything to ensure our nation's workers can succeed and thrive because when workers succeed, so does our country.",KamalaHarris,en,,303,517,3207,44
2022-06-15 15:14:02+00:00,1537091065932615680,"President Biden and I were sworn into office when our nation was facing a pandemic out of control and an economy in freefall.

But we were not deterred.

Now, we‘ve seen record job creation, record decline in unemployment, and a record increase in labor participation.",KamalaHarris,en,,1233,687,4942,175
2022-06-09 19:01:01+00:00,1534973859060928539,"The latest jobs report:

390,000 jobs were added last month. 
Nearly 9 million new jobs have been added since taking office.
Historic rates of small business creation.

There’s still more work to do, but we are seeing a shift from recovery to sustainable growth.",KamalaHarris,en,,553,469,2670,55
2022-06-09 15:27:01+00:00,1534920003895582720,"Since President Biden and I took office, our country has seen record job creation, declines in unemployment, and an increase in labor participation. 

Challenges remain, but we are headed in the right direction towards steady and stable economic growth.",KamalaHarris,en,,2343,658,5203,303
2022-05-31 19:20:01+00:00,1531717151081517058,"Since January of last year, the economy has added more than 8 million jobs. Businesses have reopened their doors. Schools are back in person. And, while there is more work to be done, we have made real progress in getting our economy back on track.",KamalaHarris,en,,1068,619,4452,116
2022-05-01 16:53:00+00:00,1520808519641051138,"While there is still more work to be done, last year, America saw record job creation, economic growth, and small business growth—it was a year of progress and recovery.

We are building a foundation for an economy that can bring everyone along.",KamalaHarris,en,,978,698,4815,70
2022-04-30 01:38:00+00:00,1520215862707474435,"Over the last year, we've seen the most significant year of job growth in history and the fastest economic growth in nearly 40 years.

Our work continues to help ease longer-term inflationary pressures and lower costs for working families.",KamalaHarris,en,,1126,657,4355,76
2022-04-04 16:29:00+00:00,1511018007400751112,"The Community Advantage program has helped launch businesses, create jobs, and drive innovation across our nation. 

We are extending the program until 2024—expanding the number of lenders in the program and increasing the amount of money they can lend.",KamalaHarris,en,,313,287,2042,21
2022-04-03 21:49:00+00:00,1510736149928718787,"Here’s the bottom line: When small business owners have the support they need, they create jobs, drive and inspire innovation, and grow our entire economy.",KamalaHarris,en,,1464,1127,8909,224
2022-03-16 22:20:01+00:00,1504220972366368771,"Over the past year, we have taken significant action to address the gender wage gap.

We passed the American Rescue Plan, which provided immediate relief to millions of women, and the Bipartisan Infrastructure Law that created good-paying jobs for many women in the workforce. https://t.co/VCmHZb2aF9",KamalaHarris,en,,282,375,2619,29
2022-03-11 14:30:04+00:00,1502290765531295756,"One year ago today, President Biden signed the American Rescue Plan into law. 

It helped deliver 500 million shots in arms, the biggest single year of job growth in history, and the largest one-year drop in unemployment on record.",KamalaHarris,en,,815,870,6041,83
2022-03-10 15:59:01+00:00,1501950762938617860,"Through the Bipartisan Infrastructure Law, historic investments are being made to our infrastructure and supply chains to prevent bottlenecks and lower daily expenses. 

We are working towards lowering costs for families while creating good-paying jobs.",KamalaHarris,en,,432,401,2680,31
2022-03-05 17:52:00+00:00,1500167258106208261,"Our economy created over 6.5 million new jobs last year—more jobs created in one year than ever before in the history of America. 

We are building a better America.",KamalaHarris,en,,1836,1110,8742,171
2022-02-13 21:40:00+00:00,1492976879598551046,"We’re not just getting rid of lead pipes. We’re creating jobs.

Through the Bipartisan Infrastructure Law, we will invest in job training, upgrade our workforce's skills, partner with our labor unions, and establish apprenticeships—all to create jobs replacing lead pipes.",KamalaHarris,en,,599,818,5943,46
2022-02-10 01:53:00+00:00,1491590996504756233,"The Executive Order on Project Labor Agreements will ensure federal construction projects are built on time—improving construction work around the country and job quality for nearly 200,000 workers.

We’re fulfilling our promise to build a more skilled and productive workforce.",KamalaHarris,en,,366,465,3017,31
2022-02-06 16:00:09+00:00,1490354635353296897,"Americans are back at work at a record-setting pace. Our economy created 467,000 jobs in January, and 6.6 million jobs have been created since we took office.

While there’s more work to be done, we are focused on rebuilding an economy that will lift up all Americans.",KamalaHarris,en,,773,852,6184,85
2022-02-06 01:42:00+00:00,1490138676545961994,"The latest jobs report shows America’s economy created 6.6 million jobs within the last year, exceeding expectations. 

We are making historic strides to build our country back better than before.",KamalaHarris,en,,681,1199,7659,64
2022-02-03 21:15:05+00:00,1489346727530348544,"There’s more work to be done, but, so far, our economy has added more than 6 million jobs. 

Together, we are helping Americans get back to work.",KamalaHarris,en,,949,819,7067,118
2022-02-03 01:33:00+00:00,1489049248566067208,"We still have a lot of work ahead of us, but we are focused on getting Americans back to work and rebuilding the middle class.

The economy has added more than 6 million jobs this past year, and the unemployment rate dropped to 3.9%.",KamalaHarris,en,,875,961,7232,81
