DateTime,TweetId,Text,Username,Language,Hashtags,ReplyCount,RetweetCount,LikeCount,QuoteCount
2023-06-01 18:20:33+00:00,1664336144652292096,We need leaders to have the courage to stand up for the children of America and pass reasonable gun safety laws. https://t.co/U06Rm73zxx,KamalaHarris,en,,1518,736,3816,73
2023-06-01 16:30:16+00:00,1664308389919309833,"Happy Pride! 

Pride Month has always been a joy-filled celebration. While we celebrate how far we’ve come, we must continue standing in solidarity with LGBTQ+ Americans in their ongoing struggle against discrimination and injustice. https://t.co/HfImGGhhwj",KamalaHarris,en,,7503,3289,26832,481
2023-05-31 19:55:21+00:00,1663997614671446016,"Small businesses are the backbone of our economy. 

Thank you to every small business owner in our nation for all you do to support and strengthen our communities. https://t.co/EpLlCT1b3K",KamalaHarris,en,,350,315,1787,22
2023-05-31 14:49:07+00:00,1663920549439963141,"From coast to coast, we are building a better future.

This year, 20,000 infrastructure projects will be underway that will transform communities, create good-paying jobs, and rebuild our nation's infrastructure. https://t.co/tfgXTMfUpM",KamalaHarris,en,,769,466,2554,33
