DateTime,TweetId,Text,Username,Language,Hashtags,ReplyCount,RetweetCount,LikeCount,QuoteCount
2023-05-31 14:49:07+00:00,1663920549439963141,"From coast to coast, we are building a better future.

This year, 20,000 infrastructure projects will be underway that will transform communities, create good-paying jobs, and rebuild our nation's infrastructure. https://t.co/tfgXTMfUpM",KamalaHarris,en,,767,466,2546,33
2023-05-27 18:48:00+00:00,1662531113892364290,"Since President @JoeBiden and I took office, over 12.5 million new jobs have been created, including 800,000 manufacturing jobs.",KamalaHarris,en,,2999,807,4478,152
2023-05-23 20:02:06+00:00,1661100209697443840,"When President Biden and I took office, we vowed to rebuild America’s manufacturing sector, bring jobs back from overseas, strengthen our supply chains, and build in America.

And we have kept that promise by investing hundreds of billions of dollars in American manufacturing. https://t.co/CThOLGh51F",KamalaHarris,en,,3221,1052,5770,158
2023-05-23 15:47:30+00:00,1661036139086528519,"12.7 million jobs have been created since we took office
253,000 jobs were added last month
The unemployment rate fell to 3.4%

While we have more work to do, we are building our economy from the bottom up and the middle out. https://t.co/CCEQe14z9h",KamalaHarris,en,,1427,678,3493,69
2023-05-21 22:41:05+00:00,1660415444518313984,"Created over 12 million jobs.
Capped insulin at $35/month for seniors.
Passed the largest climate investment ever.
Made historic infrastructure investments.
Protected marriage equality in federal law.

We've made progress, but there’s still much more to do.

Let’s finish the job. https://t.co/8rbwS58A8y",KamalaHarris,en,,5781,1996,10786,262
